{
  "schema_version": "3.0.0",
  "graph_id": "graph-design",
  "scope": {
    "tenant_id": "fixture-tenant",
    "project_id": "fixture-amplai"
  },
  "revision": 1,
  "contract_ref": {
    "id": "goal-v3",
    "revision": 1,
    "digest": "sha256:f861dcce9347b6b9a0f9a4a2b3721cd2047cc39af793449316a5478f2cba2ffe"
  },
  "previous_graph_ref": null,
  "replan_reason": null,
  "nodes": [
    {
      "node_id": "node-design",
      "work_id": "work-design",
      "target_ref": {
        "id": "app-amplai",
        "revision": 1,
        "digest": "sha256:9f90fa5340d02adcfeb484f5dfe31fffa1f5389314804d96ff98a6535a8cff2e"
      },
      "objective": "완전한 설계 패키지 작성",
      "strategy": "bounded_loop",
      "depends_on": [],
      "join": "all_required",
      "consumes": [],
      "produces": [
        {
          "name": "design-package",
          "media_type": "application/zip",
          "required": true
        }
      ],
      "acceptance_ids": [
        "AC-DESIGN"
      ],
      "verification_profile_ref": {
        "id": "verifier-design-integrity",
        "revision": 1,
        "digest": "sha256:1c44063a663f9a5db2541b7c62a218bc609e0abff8b0ad290bf8af321625e280"
      },
      "capabilities": [
        {
          "action": "workspace.design_write",
          "resource": "sandbox:design-output",
          "effect_class": "sandbox_write"
        }
      ],
      "resource_claims": [
        {
          "resource": "sandbox:design-output",
          "mode": "exclusive_write"
        }
      ],
      "budget": {
        "max_wall_seconds": 3600,
        "max_attempts": 3,
        "max_tokens": 100000,
        "max_cost_microunits": 2000000,
        "currency": "USD",
        "max_parallel_works": 4,
        "max_delegation_depth": 2
      }
    }
  ],
  "global_verification_ref": {
    "id": "fixture-ref",
    "revision": 1,
    "digest": "sha256:bc87b130fe6e2fb0156bdda50d7d14562db83b58199490694266def47b41773d"
  },
  "compiler_version": "design-spec-3.0.0",
  "created_at": "2026-09-15T13:30:00Z"
}
